{
    "$schema": "./schemas/shadcn-schema.json",
    "style": "new-york",
    "rsc": false,
    "tsx": true,
    "tailwind": {
      "config": "",
      "css": "src/index.css",
      "baseColor": "neutral",
      "cssVariables": true,
      "prefix": ""
    },
    "aliases": {
      "components": "@/components",
      "utils": "@/lib/utils",
      "ui": "@/components/ui",
      "lib": "@/lib",
      "hooks": "@/hooks"
    }
}